{
 "authority": {
  "can_decide": false,
  "note": "Step C opportunity-cost evidence does not rank/cut lands; burden and Commander-first support remain separate for later judgment."
 },
 "canonical_hash": "lh1:bdc7cc1f7dc0eeb6866bf80ada6790b5d21339bb63058b80321f352a874a3eca",
 "commander_land_text_hooks": [
  {
   "commander": "Doctor Doom, King of Latveria",
   "oracle_text": "Whenever you discard one or more land cards, each opponent loses 2 life.\nAt the beginning of combat on your turn, target Villain you control gains menace until end of turn. It connives. (Draw a card, then discard a card. If you discarded a nonland card, put a +1/+1 counter on that creature.)",
   "terms": [
    "land_card",
    "land_generic"
   ]
  }
 ],
 "confidence": "moderate",
 "deck_id": "Doctor_Doom__King_of_Latveria",
 "evidence_class": "derived_metric",
 "inputs": {
  "blueprint": "data/grixis/blueprints/doctor-doom-king-of-latveria.json",
  "graph": "data/grixis/graph/doctor-doom-king-of-latveria.json",
  "mana_base": "data/grixis/mana_base/doctor-doom-king-of-latveria.json",
  "mana_timing": "data/grixis/mana_timing/doctor-doom-king-of-latveria.json"
 },
 "land_type_context": {
  "blueprint_named_lands": [
   "Dakmor Salvage",
   "Desolate Lighthouse",
   "Geier Reach Sanitarium",
   "Villainous Hideout"
  ],
  "commander_text_relevant_types": [],
  "interpretation": "Commander Oracle land/type matches are textual hooks only; they may be opponent-facing or otherwise non-beneficial and require rules/strategic judgment.",
  "typed_land_counts": {
   "Island": 8,
   "Mountain": 7,
   "Swamp": 9
  }
 },
 "limitations": [
  "No universal opportunity-cost score is produced; color/timing burdens and strategic support signals stay separate.",
  "Blueprint exact-name mentions are Commander-first evidence, not automatic protections; absence is not evidence that a land lacks strategic value.",
  "Utility categories are Oracle-text heuristics and do not price the magnitude, activation cost, timing window or multiplayer value of the effect.",
  "Commander land/type matches are textual hooks only and can be opponent-facing (for example landwalk) or otherwise irrelevant to own mana-base construction.",
  "MDFCs are represented as spell/land option-value tradeoffs; later candidate optimization decides whether that flexibility is worth the tapped/color/slot cost.",
  "Graph package/identity signals are inherited accepted M4 evidence but do not decide a mana-base swap by themselves."
 ],
 "mdfcs": [],
 "schema_version": 1,
 "slug": "doctor-doom-king-of-latveria",
 "status": "provisional_evidence",
 "summary": {
  "blueprint_named_utility_lands": 3,
  "commander_land_hook_count": 2,
  "mdfc_count": 0,
  "utility_burden_flags": {
   "always_enters_tapped": 1,
   "conditional_mana_ability": 1,
   "no_usable_grixis_color": 2,
   "single_color_source": 2
  },
  "utility_land_count": 6,
  "utility_support_flags": {
   "graph_package_member": 3,
   "named_in_blueprint": 3,
   "nonmana_utility_text": 4
  }
 },
 "utility_lands": [
  {
   "authority": {
    "can_decide": false,
    "note": "Separate burden/support dimensions only; no utility land is automatically cut or retained."
   },
   "blueprint_named": true,
   "burden_flags": [
    "no_usable_grixis_color"
   ],
   "card": "Desolate Lighthouse",
   "conditional_mana_ability": false,
   "entry_timing": "untapped_by_default",
   "graph_packages": [
    "pkg:land-discard-outlets"
   ],
   "graph_roles": [
    "land"
   ],
   "oracle_text": "{T}: Add {C}.\n{1}{U}{R}, {T}: Draw a card, then discard a card.",
   "potential_colors": "",
   "support_flags": [
    "graph_package_member",
    "named_in_blueprint",
    "nonmana_utility_text"
   ],
   "unconditional_colors": "",
   "utility_categories": [
    "card_advantage"
   ]
  },
  {
   "authority": {
    "can_decide": false,
    "note": "Separate burden/support dimensions only; no utility land is automatically cut or retained."
   },
   "blueprint_named": true,
   "burden_flags": [
    "no_usable_grixis_color"
   ],
   "card": "Geier Reach Sanitarium",
   "conditional_mana_ability": false,
   "entry_timing": "untapped_by_default",
   "graph_packages": [
    "pkg:land-discard-outlets"
   ],
   "graph_roles": [
    "land"
   ],
   "oracle_text": "{T}: Add {C}.\n{2}, {T}: Each player draws a card, then discards a card.",
   "potential_colors": "",
   "support_flags": [
    "graph_package_member",
    "named_in_blueprint"
   ],
   "unconditional_colors": "",
   "utility_categories": []
  },
  {
   "authority": {
    "can_decide": false,
    "note": "Separate burden/support dimensions only; no utility land is automatically cut or retained."
   },
   "blueprint_named": false,
   "burden_flags": [
    "always_enters_tapped"
   ],
   "card": "Oscorp Industries",
   "conditional_mana_ability": false,
   "entry_timing": "always_tapped",
   "graph_packages": [],
   "graph_roles": [
    "land"
   ],
   "oracle_text": "This land enters tapped.\nWhen this land enters from a graveyard, you lose 2 life.\n{T}: Add {U}, {B}, or {R}.\nMayhem (You may play this card from your graveyard if you discarded it this turn. Timing rules still apply.)",
   "potential_colors": "UBR",
   "support_flags": [
    "nonmana_utility_text"
   ],
   "unconditional_colors": "UBR",
   "utility_categories": [
    "graveyard"
   ]
  },
  {
   "authority": {
    "can_decide": false,
    "note": "Separate burden/support dimensions only; no utility land is automatically cut or retained."
   },
   "blueprint_named": false,
   "burden_flags": [
    "single_color_source"
   ],
   "card": "Otawara, Soaring City",
   "conditional_mana_ability": false,
   "entry_timing": "untapped_by_default",
   "graph_packages": [],
   "graph_roles": [
    "land"
   ],
   "oracle_text": "{T}: Add {U}.\nChannel — {3}{U}, Discard this card: Return target artifact, creature, enchantment, or planeswalker to its owner's hand. This ability costs {1} less to activate for each legendary creature you control.",
   "potential_colors": "U",
   "support_flags": [
    "nonmana_utility_text"
   ],
   "unconditional_colors": "U",
   "utility_categories": [
    "cost_reduction_or_ramp"
   ]
  },
  {
   "authority": {
    "can_decide": false,
    "note": "Separate burden/support dimensions only; no utility land is automatically cut or retained."
   },
   "blueprint_named": false,
   "burden_flags": [
    "single_color_source"
   ],
   "card": "Takenuma, Abandoned Mire",
   "conditional_mana_ability": false,
   "entry_timing": "untapped_by_default",
   "graph_packages": [],
   "graph_roles": [
    "land"
   ],
   "oracle_text": "{T}: Add {B}.\nChannel — {3}{B}, Discard this card: Mill three cards, then return a creature or planeswalker card from your graveyard to your hand. This ability costs {1} less to activate for each legendary creature you control.",
   "potential_colors": "B",
   "support_flags": [
    "nonmana_utility_text"
   ],
   "unconditional_colors": "B",
   "utility_categories": [
    "cost_reduction_or_ramp",
    "graveyard",
    "recursion"
   ]
  },
  {
   "authority": {
    "can_decide": false,
    "note": "Separate burden/support dimensions only; no utility land is automatically cut or retained."
   },
   "blueprint_named": true,
   "burden_flags": [
    "conditional_mana_ability"
   ],
   "card": "Villainous Hideout",
   "conditional_mana_ability": true,
   "entry_timing": "untapped_by_default",
   "graph_packages": [
    "pkg:villains-connive"
   ],
   "graph_roles": [
    "land"
   ],
   "oracle_text": "{T}: Add {C}.\n{T}: Add one mana of any color. Spend this mana only to cast a Villain spell or to activate an ability of a Villain source.\n{3}, {T}: Target Villain you control connives. Activate only as a sorcery. (Draw a card, then discard a card. If you discarded a nonland card, put a +1/+1 counter on that creature.)",
   "potential_colors": "UBR",
   "support_flags": [
    "graph_package_member",
    "named_in_blueprint"
   ],
   "unconditional_colors": "",
   "utility_categories": []
  }
 ]
}
